artist,year,lyrics,recognized,name,topic1,topic2,decade,id,song_hash
Elvis Presley,1960,"You can shake an apple off an apple tree

Shake-a, shake- sugar,

But you'll never shake me

Uh-uh-uh

No-sir-ee, uh, uh

I'm gonna stick like glue,

Stick because I'm

Stuck on you



Gonna run my fingers thru your long black hair

Squeeze you tighter than a grizzly bear

Uh-uh-uh,

Yes-sir-ee, uh, uh

I'm gonna stick like glue

Stick, because I'm

Stuck on you



Hide in the kitchen, hide in the hall

Ain't gonna do you no good at all

'Cause once I catch ya and the kissin' starts

A team o' wild horses couldn't tear us apart



Try to take a tiger from his daddy's side

That's how love is gonna keep us tied

Uh-uh-uh

Yes-sir-ee, uh,uh

I'm gonna stick like glue

Stick, because I'm

Stuck on you",0,Stuck on You,Desire (love/flirting),Love (devotion),1970,0,Stuck on YouElvis Presley
Joe Dowell,1961,"Can't you see I love you
Please don't break my heart in two
That's not hard to do
Cause I don't have a wooden heart
And if you say goodbye
Then I know that I would cry
Maybe I would die
Cause I don't have a wooden heart
There's no strings
Upon this love of mine
It was always you from the start
Treat me nice, treat me good
Treat me like you really should
Cause I'm not made of wood and
I don't have a wooden heart
Muss i denn, muss i denn
Zum Städtele 'naus
Städtele ?naus und
Du mein Schatz bleibst hier
Muss i denn, muss i denn
Zum Städtele 'naus
Städtele ?naus und
Du mein Schatz bleibst hier
There's no strings
Upon this love of mine
It was always you from the start
Sei mir gut, sei mir gut
Sei mir wie du wirklich sollst
Wie du wirklich sollst
Cause I don't have a wooden heart",0,Wooden Heart,Break-up (heartbreak),Struggle (mental health/societal issue),1960,1,Wooden HeartJoe Dowell
The Sensations,1962,"Let me in whee-ooh (whee-ooh, whee-ooh, hoop-whee-ooh)
(Whee-ooh, whee-ooh, hoo-ooh-oop-whee-ooh, whee-ooh)

I can see the dancin' (let me in)
The silhouettes on the shade
I hear the music (music), all the lovers on parade

Open up (let me in), I want to come in again

I thought you were my friend



Pitter patter of those fee-ee-ee-ee-eet

Movin' and a-groovin' with that be-eat

Jumpin' and stompin on the flo-o-o-o-oor

(Lemme in) Let me in!

(Open up) Open up!

Why don't you open up that door? (let me in)



I-uh (open up) hear music let me in (music)

I want to come in again

Let me in (let me in), a-well I heard it just then

I thought you were my friend



(Whee-ooh, whee-ooh, hoop-whee-ooh)

(Whee-ooh, whee-ooh, hoo-ooh-oop-whee-ooh, whee-ooh)



Pitter patter of the fee-ee-ee-ee-eet

Movin' and a-groovin' with that be-eat

Jumpin' and stompin on the flo-o-o-o-oor

(Lemme in) Let me in!

(Open up) Open up!

Why don't you open up that door? (let me in)



I-uh-I-uh-I (open up) hear music, let me in (music)

Oh I heard it just then

Let me in (let me in)

I want to come in again

I thought you were my friend



(Whee-ooh, whee-ooh, hoop-whee-ooh)

(Whee-ooh, whee-ooh, hoo-ooh-oop-whee-ooh)

(Hoo-ooh-oop-whee-ooh)

(Hoo-ooh-oop-whee-ooh)

FADE

(Hoo-ooh-oop-whee-ooh)",0,Let Me In,Desire (love/flirting),Dancing (clubbing/happy),2010,2,Let Me InThe Sensations
Bobby Darin,1963,"You're the reason I'm living
You're the breath that I take
You're the stars in my heaven
You're the sun when I wake
You're the reason I'm living
Oh you carry me through
All of life's little burdens
I'd be lost without you
A long long time ago
When I was down
Wo-o-o you picked me up
And showed me true love
Still could be found
You're the reason I do things
You're the things that I do
You're the reason I'm livin
I'd be lost without you
Come and tell me again
You're the reason I'm living
Oh you carry me through
All of life's little burdens
I'd be lost without you",0,You're the Reason I'm Living,Love (devotion),Break-up (heartbreak),2000,3,You're the Reason I'm LivingBobby Darin
Gale Garnett,1964,"We'll Sing In the Sunshine
-Artist: Gale Garnett from \""Remembering the '50's and '60's\""
-Reader's Digest RDA-030/A
-peak Billboard position # 4 in 1964
-also won Grammy for \""Best Folk Recording Of 1964\""
-Words and Music by Gale Garnett
We'll sing in the sunshine
We'll laugh every da-a-y
We'll sing in the sunshine
Then I'll be on my way
I will never love you
The cost of love's too dear
But though I'll never love you
I'll stay with you one year
And we can sing in the sunshine
We'll laugh every da-a-y
We'll sing in the sunshine
Then I'll be on my way
I'll sing to you each mornin'
I'll kiss you every night
But darlin', don't cling to me
I'll soon be out of sight
But we can sing in the sunshine
We'll laugh every da-a-y
We'll sing in the sunshine
Then I'll be on my way
My daddy he once told me
\""Hey, don't you love you any man\""
\""Just take what they may give you\""
\""And give but what you can\""
\""And you can sing in the sunshine\""
\""You'll laugh every da-a-y\""
\""You'll sing in the sunshine\""
\""Then be on your way\""
And when our year has ended
And I have gone away
You'll often speak about me
And this is what you'll say
\""We sang in the sunshine
\""You know, we laughed every da-a-y\""
\""We sang in the sunshine\""
\""Then she went away\""",0,We'll Sing in the Sunshine,Break-up (heartbreak),Struggle (mental health/societal issue),1960,4,We'll Sing in the SunshineGale Garnett
Herman's Hermits,1965,"(Carter/Lewis)

Every time I see you lookin' my way

Baby, baby, can't you hear my heartbeat?

In the car or walking down the highway

Baby, baby, can't you hear my heartbeat?



When you move up closer to me

I get a feelin' that's ooo-wee

Can't you hear the poundin' of my heartbeat

'cause you're the one I love, you're the one I love



When I feel you put your arms around me

Baby, baby, can't you hear my heartbeat?

Then I'm glad, I'm mighty glad I found you

Baby, baby, can't you hear my heartbeat?



When you asked me to meet your Ma

I knew that baby, we'd be going far

Can't you hear the poundin' of my heartbeat?

'cause you're the one I love, you're the one I love



[Rhythm guitar]



All my friends are cryin' out to meet you

Baby, baby, can't you hear my heartbeat?

Now's the time to go and see the preacher

Baby, baby, can't you hear my heartbeat?



Wedding bells are gonna chime

Baby, baby, you're gonna be mine

Can't you hear the poundin' of my heartbeat

'cause you're the one I love, you're the one I love



Baby, baby, can't you hear my heartbeat?

Baby, baby, can't you hear my heartbeat?

Baby, baby, can't you hear my heartbeat?",0,Can't You Hear My Heartbeat,Desire (love/flirting),Love (devotion),1980,5,Can't You Hear My HeartbeatHerman's Hermits
Bobby Hebb,1966,"Sunny, yesterday my life was filled with rain
Sunny, you smiled at me and really eased the pain
Now the dark days are done and the bright days are here
My Sunny one shines so sincere
Sunny, one so true, I love you


Sunny, thank you for the sunshine bouquet

Sunny, thank you for the love you've brought my way

You gave to me your all and all

And now I feel ten feet tall

Sunny, one so true, I love you



Sunny, thank you for the truth you've let me see

Sunny, thank you for the facts from A to Z

My life was torn like wind-blown sand

Then a rock was formed when we held hands

Sunny, one so true, I love you



Sunny, thank you for that smile upon your face

Sunny, thank you, thank you for that gleam that flows with grace

You're my spark of nature's fire

You're my sweet complete desire

Sunny, one so true, yes, I love you



Sunny, yesterday all my life was filled with rain

Sunny, you smiled at me and really, really eased the pain

Now the dark days are done and the bright days are here

My Sunny one shines so sincere

Sunny, one so true, I love you

I love you (Sunny)

I love you (Sunny)

Said I love you (Sunny)",0,Sunny,Dancing (clubbing/happy),Other,1970,6,SunnyBobby Hebb
Frankie Valli,1967,"You're just too good to be true

Can't take my eyes off of you

You'd be like heaven to touch

I wanna hold you so much

At long last love has arrived

And I thank God I'm alive

You're just too good to be true

Can't take my eyes off of you



Pardon the way that I stare

There's nothing else to compare

The sight of you leaves me weak

There are no words left to speak

But if you feel like I feel

Please let me know that it's real

You're just too good to be true

Can't take my eyes off of you



I love you baby and if it's quite all right

I need you baby to warm the lonely nights

I love you baby, trust in me when I say

Oh pretty baby, don't bring me down I pray

Oh pretty baby, now that I've found you stay

And let me love you baby, let me love you



You're just too good to be true

Can't take my eyes off of you

You'd be like heaven to touch

I wanna hold you so much

At long last love has arrived

And I thank God I'm alive

You're just too good to be true

Can't take my eyes off of you



I love you baby and if it's quite all right

I need you baby to warm the lonely nights

I love you baby, trust in me when I say

Oh pretty baby, don't bring me down I pray

Oh pretty baby, now that I've found you stay

Oh pretty baby, trust in me when I say",0,Can't Take My Eyes Off You,Desire (love/flirting),Love (devotion),1990,7,Can't Take My Eyes Off YouFrankie Valli
Jeannie C. Riley,1968,"I wanna tell you all a story 'bout a Harper Valley widowed wife,

Who had a teenage daughter who attended Harper Valley Junior High,

Well her daughter came home one afternoon and didn't even stop to play,

And she said.\""Mom I got a note here from the Harper Valley PTA.\""

Well the note said, \""Mrs. Johnson, you're wearing your dresses way too high.

It's reported you've been drinkin' and runnin' round with men and goin' wild.

And we don't believe you oughta be a bringin' up your little girl this way.\""

And it was signed by the secretary, \""Harper Valley PTA.\""



Well it happened that the PTA was gonna meet that very afternoon.

And they were sure surprised when Mrs. Johnson wore her mini-skirt into the room.

And as she walked up to the black board, I still recall the words she had to say.

She said I'd like to address this meeting of the Harper Valley PTA.



Well, there's Bobby Taylor sittin' there, and seven tims he's asked me for a date.

And Mrs. Taylor seems to use a lotta ice, whenever he's away.

And Mr. Baker can you tell us why your secretary had to leave this town?

And shouldn't widow Jones be told to keep her window shades a pulled completely down.



Well Mr. Harper couldn't be here cause he stayed too long at Kelly's Bar again.

And if you smell Shirley Thompson's breath you'll find she's had a little nip of gin.

And then you have the nerve to tell me, you think that as a mother I'm not fit.

Well this is just a little Peyton Place, and you're all Harper Valley hypocrites.



No, I wouldn't put you on because, it really did happen just this way.

The day my momma socked it to, the Harper Valley PTA.

The day my momma socked it to, the Harper Valley PTA",0,Harper Valley PTA,Struggle (mental health/societal issue),Other,2000,8,Harper Valley PTAJeannie C. Riley
Tommy James and the Shondells,1969,"Ah

Now I don't hardly know her

But I think I could love her

Crimson and clover

Ah

Well if she come walkin' over

Now I been waitin' to show her

Crimson and clover

Over and over



My mind's such a sweet thing

I wanna do everything

What a beautiful feeling

Crimson and clover

Over and over



Crimson and clover, over and over (repeat)",0,Crimson and Clover,Desire (love/flirting),Love (devotion),1990,9,Crimson and CloverTommy James and the Shondells
Freda Payne,1970,"Now that you're gone,

All that's left is a band of gold

All that's left of the dreams I hold

Is a band of gold

And the memories of what love could be

If you were still here with me



You took me from the shelter of my mother

I had never known or loved any other

We kissed after taking vows

But that night on our honeymoon,

We stayed in separate rooms



I wait in the darkness of my lonely room

Filled with sadness, filled with gloom

Hoping soon

That you'll walk back through that door

And love me like you tried before



Since you've been gone,

All that's left is a band of gold

All that's left of the dreams I hold

Is a band of gold

And the dream of what love could be

If you were still here with me



INSTRUMENTAL BRIDGE



Ohhhhhhhhhhhhhh



Don't you know that I wait

In the darkness of my lonely room

Filled with sadness, filled with gloom

Hoping soon

That you'll walk back through that door

And love me like you tried before



Since you've been gone,

All that's left is a band of gold

All that's left of the dreams I hold

Is a band of gold

And the dream of what love could be

If you were still here with me

(repeat and fade out)",0,Band of Gold,Love (devotion),Break-up (heartbreak),2010,10,Band of GoldFreda Payne
Janis Joplin,1971,"Busted flat in Baton Rouge, waiting for a train
And I am feeling near as faded as my jeans.
Bobby thumbed a diesel down just before it rained,
It rode us all the way to New Orleans.
I pulled my harpoon out of my dirty red bandanna,
I was playing soft while Bobby sang the blues.
Windshield wipers slapping time, I was holding Bobby?s hand in mine,
We sang every song that driver knew.
Freedom is just another word for nothing left to lose,
Nothing don?t mean nothing honey if it ain?t free, now now.
And feeling good was easy, Lord, when he sang the blues,
You know feeling good was good enough for me,
Good enough for me and my Bobby McGee.
From the Kentucky coal mines to the California sun,
Hey, Bobby shared the secrets of my soul.
Through all kinds of weather, through everything that we done,
Hey Bobby baby kept me from the cold.
One day up near Salinas, Lord, I let him slip away,
He?s looking for that home and I hope he finds it,
But I?d trade all of my tomorrows for one single yesterday
To be holding Bobby?s body next to mine.
Freedom is just another word for nothing left to lose,
Nothing, that?s all that Bobby left me, yeah,
But feeling good was easy, Lord, when he sang the blues,
Hey, feeling good was good enough for me, hmm hmm,
Good enough for me and my Bobby McGee.
La la la, la la la la, la la la, la la la la
La la la la la Bobby McGee.
La la la la la, la la la la la
La la la la la, Bobby McGee, la.
La La la, la la la la la la,
La La la la la la la la la, hey now Bobby now Bobby McGee yeah.
Na na na na na na na na, na na na na na na na na na na na
Hey now Bobby now, Bobby McGee, yeah.
Lord, I?m calling my lover, calling my man,
I said I?m calling my lover just the best I can,
C?mon, where is Bobby now, where is Bobby McGee, yeah,
Lordy Lordy Lordy Lordy Lordy Lordy Lordy Lord
Hey, hey, hey, Bobby McGee, Lord!
Yeah! Whew!
Lordy Lordy Lordy Lordy Lordy Lordy Lordy Lord
Hey, hey, hey, Bobby McGee.",0,Me and Bobby McGee,Desire (love/flirting),Love (devotion),1970,11,Me and Bobby McGeeJanis Joplin
Bill Withers,1972,"Sometimes, in our lives 
We all have pain, we all have sorrow 
But, if we are wise 
We know that there's always tomorrow 
Lean on me, when you're not strong 

And I'll be your friend, I'll help you carry on 

For, it won't be long 

Til I'm gonna need somebody to lean on 



Please swallow your pride 

If I have things you need to borrow 

For no one can fill 

Those of your needs that you won't let show 



You just call on me brother when you need a hand 

We all need somebody to lean on 

I just might have a problem that you'll understand 

We all need somebody to lean on 



Lean on me, when you're not strong 

And I'll be your friend, I'll help you carry on 

For, it won't be long 

Til I'm gonna need somebody to lean on 



You just call on me brother when you need a hand 

We all need somebody to lean on 

I just might have a problem that you'll understand 

We all need somebody to lean on 



If there is a load 

You have to bear, that you can't carry 

I'm right up the road 

I'll share your load if you just call me 

Call me if you need a friend 

Call me ...",0,Lean on Me,Friendship,Struggle (mental health/societal issue),2000,12,Lean on MeBill Withers
Carly Simon,1973,"You walked into the party like you were walking onto a yacht

Your hat strategically dipped below one eye

Your scarf it was apricot

You had one eye on the mirror as you watched yourself gavotte

And all the girls dreamed that they'd be your partner

They'd be your partner, and...



You're so vain, you probably think this song is about you

You're so vain, I'll bet you think this song is about you

Don't you? Don't You?



You had me several years ago when I was still quite naive

Well you said that we made such a pretty pair

And that you would never leave

But you gave away the things you loved and one of them was me

I had some dreams, they were clouds in my coffee

Clouds in my coffee, and...



I had some dreams they were clouds in my coffee

Clouds in my coffee, and...

Well I hear you went up to Saratoga and your horse naturally won

Then you flew your lear jet up to Nova Scotia

To see the total eclipse of the sun

Well you're where you should be all the time

And when you're not you're with

Some underworld spy or the wife of a close friend

Wife of a close friend, and...",0,You're So Vain,Break-up (heartbreak),Struggle (mental health/societal issue),2010,13,You're So VainCarly Simon
Elton John,1974,"Hey kids, shake it loose together

The spotlight's hitting something

That's been known to change the weather

We'll kill the fatted calf tonight

So stick around

You're gonna hear electric music

Solid walls of sound



Say, Candy and Ronnie, have you seen them yet

But they're so spaced out, Bennie and the Jets

Oh but they're weird and they're wonderful

Oh Bennie she's really keen

She's got electric boots a mohair suit

You know I read it in a magazine

Bennie and the Jets



Hey kids, plug into the faithless

Maybe they're blinded

But Bennie makes them ageless

We shall survive, let us take ourselves along

Where we fight our parents out in the streets

To find who's right and who's wrong



Oh, Candy and Ronnie, have you seen them yet

But they're so spaced out, Bennie and the Jets

Oh but they're weird and they're wonderful

Oh Bennie she's really keen

She's got electric boots a mohair suit

You know I read it in a magazine

Bennie and the Jets



Oh, Candy and Ronnie, have you seen them yet

But they're so spaced out, Bennie and the Jets

Oh but they're weird and they're wonderful

Oh Bennie she's really keen

She's got electric boots a mohair suit

You know I read it in a magazine

Bennie and the Jets



Bennie, Bennie and the Jets

Bennie, Bennie, Bennie, Bennie and the jets

Bennie, Bennie, Bennie, Bennie, Bennie and the jets

Bennie, Bennie, Bennie, Bennie and the jets

Bennie, Bennie and the jets",0,Bennie and the Jets,Dancing (clubbing/happy),Other,1970,14,Bennie and the JetsElton John
Neil Sedaka,1975,"Strolling along country roads with my baby

It starts to rain, it begins to pour

Without an umbrella we're soaked to the skin

I feel a shiver run up my spine

I feel the warmth of her hand in mine

Ooooo, I hear laughter in the rain

Walking hand in hand with the one I love

Ooooo, how I love the rainy days

And the happy way I feel inside



After a while we run under a tree

I turn to her and she kisses me

There with the beat of the rain on the leaves

Softly she breathes and I close my eyes

Sharing our love under stormy skies



Ooooo, I hear laughter in the rain

Walking hand in hand with the one I love

Ooooo, how I love the rainy days

And the happy way I feel inside

I feel the warmth of her hand in mine



[Musical Interlude]



I feel the warmth of her hand in mine

Ooooo, I hear laughter in the rain

Walking hand in hand with the one I love

Ooooo, how I love the rainy days

And the happy way I feel inside

Ooooh, I hear laughter in the rain

Walking hand in hand with the one I love

Ooooo, how I love the rainy days

And the happy way I feel inside",0,Laughter in the Rain,Love (devotion),Friendship,1980,15,Laughter in the RainNeil Sedaka
Starland Vocal Band,1976,"Gonna find my baby, gonna hold her tight

Gonna grab some afternoon delight

My motto's always been 'when it's right, it's right'

Why wait until the middle of a cold dark night?

When everything's a little clearer in the light of day

And we know the night is always gonna be there any way



Thinkin' of you's workin' up my appetite

Looking forward to a little afternoon delight

Rubbin' sticks and stones together makes the sparks ingite

And the thought of lovin' you is getting so exciting

Sky rockets in flight

Afternoon delight

Afternoon delight

Afternoon delight



Started out this morning feeling so polite

I always though a fish could not be caught who wouldn't bite

But you've got some bait a waitin' and I think I might try nibbling

A little afternoon delight

Sky rockets in flight

Afternoon delight

Afternoon delight

Afternoon delight



Please be waiting for me, baby, when I come around

We could make a lot of lovin' 'for the sun goes down



Thinkin' of you's workin' up my appetite

Looking forward to a little afternoon delight

Rubbin' sticks and stones together makes the sparks ingite

And the thought of lovin' you is getting so exciting

Sky rockets in flight

Afternoon delight

Afternoon delight

Afternoon delight



Afternoon delight!",0,Afternoon Delight,Desire (love/flirting),Other,1970,16,Afternoon DelightStarland Vocal Band
Mary MacGregor,1977,"There are times when a woman

has to say what's on her mind

eventhough she knows how much its gonna hurt

Before I say another word

let me tell you, I love you

let me hold you close and say these words

as gently as I can



There's been another man

that I've meeted and I love

But that doesn't mean I love you less

And he knows he can't posses me

and he knows he never will

Is just this empty place inside of me

That only he can fill



Torn between two lovers

feelin like a fool

Loving both of you

Is breaking all the rules

Torn between two lovers

feelin like a fool

Loving you both is breaking all the rules



You musn't think you failed me

just because there's someone else

you were the first real love I've ever had

And all the things I ever said

I swear they still are true

For no one else can have the part of me I gave to you



Torn between two lovers

feelin like a fool

Loving both of you

Is breaking all the rules

Torn between two lovers

feelin like a fool

Loving you both is breaking all the rules



Couldn't really blame you

if you turn and walk away

But with everything I feel inside

I'm asking you to stay



Torn between two lovers

feelin like a fool

Loving both of you

Is breaking all the rules

Torn between two lovers

feelin like a fool

Loving you both is breaking all the rules",0,Torn Between Two Lovers,Love (devotion),Struggle (mental health/societal issue),1970,17,Torn Between Two LoversMary MacGregor
Player,1978,"Spending all my nights, 
All my money going out on the town

Doing anything just to get you off of my mind

But when the morning comes,

I'm right back where I started again

Trying to forget you is just a waste of time



Baby come back, any kind of fool could see

There was something in everything about you

Baby come back, you can blame it all on me

I was wrong, and I just can't live without you



All day long, wearing a mask of false bravado

Trying to keep up the smile that hides a tear

But as the sun goes down, I get that empty feeling again

How I wish to God that you were here



Baby come back, any kind of fool could see

There was something in everything about you

Baby come back, you can blame it all on me

I was wrong, and I just can't live without you



Now that I put it all together

Give me the chance to make you see

Have you used up all the love in your heart

Nothing left for me, ain't there nothing left for me



Baby come back, any kind of fool could see

There was something in everything about you

Baby come back, you can blame it all on me

I was wrong, and I just can't live without you



I was wrong, and I just can't live",0,Baby Come Back,Break-up (heartbreak),Struggle (mental health/societal issue),1970,18,Baby Come BackPlayer
Anita Ward,1979,"I'm glad you're home

Well, did you really miss me?

I guess you did by the look in your eye (look in your eye, look in your eye)

Well lay back and relax while I put away the dishes

Then you and me can rock a bell

You can ring my be-e-ell, ring my bell

You can ring my be-e-ell, ring my bell

You can ring my be-e-ell, ring my bell

You can ring my be-e-ell, ring my bell



The night is young and full of possibilities

Well come on and let yourself be free

My love for you, so long I've been savin'

Tonight was made for me and you



You can ring my be-e-ell, ring my bell (ring my bell, ding-dong-ding)

You can ring my be-e-ell, ring my bell (ring my bell, ring-a-ling-a-ling)

You can ring my be-e-ell, ring my bell (ring my bell, ding-dong-ding)

You can ring my be-e-ell, ring my bell (ring my bell, ring-a-ling-a-ling)



(you can ring my bell, you can ring my bell

ding, dong, ding, ah-ah, ring it!

you can ring my bell, anytime, anywhere

ring it, ring it, ring it, ring it, oww!

you can ring my bell, you can ring my bell

ding, dong, ding, ah-ah, ring it!

you can ring my bell, anytime, anywhere

ring it, ring it, ring it, ring it, oww!)



You can ring my be-e-ell, ring my bell (ring my bell, ding-dong-ding)

You can ring my be-e-ell, ring my bell (ring my bell, ring-a-ling-a-ling)

You can ring my be-e-ell, ring my bell (ring my bell, ding-dong-ding)

You can ring my be-e-ell, ring my bell (ring my bell, ring-a-ling-a-ling)",0,Ring My Bell,Desire (love/flirting),Love (devotion),1970,19,Ring My BellAnita Ward
