artist,year,lyrics,recognized,name,topic1,topic2,decade,id,song_hash
Sam Hunt,2017,"Got a girl from the south side, got braids in her hair

First time I seen her walk by, man I 'bout fell off my chair

Had to get her number, it took me like six weeks

Now me and her go way back like Cadillac seats

Body like a back road, drivin' with my eyes closed

I know every curve like the back of my hand

Doin' 15 in a 30, I ain't in no hurry

I'ma take it slow just as fast as I can



The way she fit in them blue jeans, she don't need no belt

But I can turn them inside out, I don't need no help

Got hips like honey, so thick and so sweet

It ain't no curves like hers on them downtown streets



Body like a back road, drivin' with my eyes closed

I know every curve like the back of my hand

Doin' 15 in a 30, I ain't in no hurry

I'ma take it slow just as fast as I can



We're out here in the boondocks

With the breeze and the birds

Tangled up in the tall grass

With my lips on hers

On the highway to heaven

Headed south of her smile

Get there when we get there

Every inch is a mile



Body like a back road, drivin' with my eyes closed

I know every curve like the back of my hand

Doin' 15 in a 30, I ain't in no hurry

I'ma take it slow just as fast as I can



I'ma take it slow

As fast as I can

Body like a back road

Drivin' with my eyes closed

I know every curve like the back of my hand",0,Body Like a Back Road,Desire (love/flirting),Dancing (clubbing/happy),2000,57,Body Like a Back RoadSam Hunt
Cardi B,2018,"Yeah baby

I like it like that

You gotta believe me when I tell you

I said I like it like that

You gotta believe me when I tell you

I said I like it like that



Now I like dollars, I like diamonds

I like stunting, I like shining

I like million dollar deals

Where's my pen, bitch I'm signin'

I like those Balenciagas

The ones that look like socks

I like going to the jeweler

I put rocks all in my watch

I like texts from my exes

When they want a second chance

I like proving niggas wrong

I do what they say I can't

They call me Cardi Bardi, banging body

Spicy mami, hot tamale

Hotter than a Somali

Fur coat, Ferrari

Hop out the stu, jump in the coupe

They trippin' on top of the roof

Flexing on bitches as hard as I can

Eating halal, driving the Lam'

Told that bitch I'm sorry, though

'Bout my coins like Mario

Yeah they call me Cardi B

I run this shit like cardio

Oh, damn



Diamonds, just forget the chains

I said I like it like that

Instead of fighting, know I'm gang gang gang gang

I said I like it like that

Drop the top and blow the brains

I said I like it like that

Oh he's so handsome, what's his name?

I said I like it like that

Oh I need the dollars

I said I like it like that

Beat it up like piñatas

I said I like it like that

Tell the driver, close the curtains

I said I like it like that

Bad bitch make him nervous

I said I like it like that

Cardi B!



Chambean, chambean, pero no jalan (¡jalan!)

Tú compras to'a las Jordan, bobo, a mí me las regalan

I spend in the club (wuh), while you hop in the bank (yeh)

This is the new religion, bang, en latino gang, gang, yeh, yeh

Trato de hacer dieta (heh), pero es que en el closet tengo mucha grasa (wuh)

Ya mude la Gucci pa' dentro de casa, yeh (¡wuh!)

Cabrón, a ti no te conocen ni en Plaza (no)

El Diablo me llama pero Jesucristo me abraza

Guerrero como Eddie, que viva la raza (yeh)

Me gustan boricuas, me gustan cubanas

Me gusta el acento de las colombianas (¿qué hubo pues?)

Como mueve el culo la dominicana (¿qué lo que?)

Lo rico que me chingan las venezolanas (woo!)

Andamos activos, Perico Pin-Pin

Billetes de cien en el maletín (ching)

Que retumbe el bajo, Bobby Valentin, yeh

Aquí es prohibido amar, diles Charytín

Que pa'l pico les tengo Claritin

Yo llego a la disco y se forma el motín



Diamonds, just forget the chains

Bad Bunny Pa, pa, pa, pa

I said I like it like that

Instead of fighting, know I'm gang gang gang gang

I said I like it like that

Drop the top and blow the brains

I said I like it like that

Oh he's so handsome, what's his name?

I said I like it like that

Oh I need the dollars

I said I like it like that

Beat it up like piñatas

I said I like it like that

Tell the driver, close the curtains

I said I like it like that

Bad bitch make him nervous

I said I like it like that



Como Celia Cruz tengo el azucar (azuca')

Tu jeva me vio y se fue de pecho como Jimmy Snuka

Te vamos a tumbar la peluca

Y arranca pa'l carajo cabrón, que a ti no te vo'a pasar la juca (juca, juca)

Mis tenis Balenciaga, me reciben en la entrada

Pa-pa-pa-pa-razzi, like I'm Lady Gaga

Y no te me hagas, que en cover de Billboard tú has visto mi cara

No salgo de tu mente

Donde quieras que viajes has escuchado \""Mi Gente\""

Yo no soy high, soy como el Testarossa (Testarossa)

Yo soy el que se la vive y también el que la goza (goza, goza)

En la cosa, mami en la cosa (cosa, cosa)

El quien mira sufre y el que toca goza (goza, goza)



I said I like it like that

I said I like it like that (rrr)

I said I like it like that

I said I like it like that



Diamonds, just forget the chains

I said I like it like that

Instead of fighting, know I'm gang gang gang gang

I said I like it like that

Drop the top and blow the brains

I said I like it like that

Oh he's so handsome, what's his name?

I said I like it",1,I Like It,Desire (love/flirting),Money (power/flexing),2010,58,I Like ItCardi B
Travis Scott,2019,"Astro, yeah

Sun is down, freezin' cold

That's how we already know winter's here

My dawg would prolly do it for a Louis belt

That's just all he know, he don't know nothin' else

I tried to show 'em, yeah

I tried to show 'em, yeah, yeah

Yeah, yeah, yeah

Gone on you with the pick and roll

Young LaFlame, he in sicko mode





Woo, made this here with all the ice on in the booth

At the gate outside, when they pull up, they get me loose

Yeah, Jump Out boys, that's Nike boys, hoppin' out coupes

This shit way too big, when we pull up give me the loot (gimme the loot!)

Was off the Remy, had to Papoose

Had to hit my old town to duck the news

Two-four hour on lockdown, we made no moves

Now it's 4AM and I'm back up poppin' with the crew

I just landed in, Chase B mixes pop like Jamba Juice

Different colored chains, think my jeweler really sellin' fruits

And they chokin', man, know the crackers wish it was a noose



Some-some-some, someone said

To win the retreat, we all in too deep

Playin' for keeps, don't play us for weak (Someone said)

To win the retreat, we all in too deep

P-p-playin' for keeps, don't play us for weak



This shit way too formal, y'all know I don't follow suit

Stacy Dash, most these of girls ain't got a clue

All of these hoes I made off records I produced

I might take all my exes and put 'em all in a group

Hit my eses, I need the booch

'Bout to turn this function to Bonnaroo

Told her \""hop in, you comin' too\""

In the 305, bitches treat me like I'm Uncle Luke (don't stop, pop that pussy)

Had to slop the top off, it's just a roof

She said \""where we goin'?\"" I said \""the moon\""

We ain't even make it to the room

She thought it was the ocean, it's just the pool

Now I got her open, it's just the Goose

Who put this shit together? I'm the glue

(Someone said)

Shorty FaceTimed me out the blue



(Someone said)

To win the retreat, we all in too deep

Playin' for keeps, don't play us for weak (Someone said)

To win the retreat, we all in too deep

Playin' for keeps, don't play us for weak





Yeah

Astro

Yeah, yeah

Tay Keith, fuck these niggas up

Ay, ay



She's in love with who I am

Back in high school, I used to bust it to the dance (yeah)

Now I hit that epioo with duffles in my hands

I did half a Xan, thirteen hours 'til I land

Had me out like a light, ayy, yeah

Like a light, ayy, yeah

Like a light, ayy



Slept through the flight, ayy

Knocked for the night, ayy, 767, man

This shit got double bedroom, man

I still got scores to settle, man

I crept down the block (down the block)

Made a right (yeah, right)

Cut the lights (yeah, what?)

Paid the price (yeah)

Niggas think it's sweet (nah, nah)

It's on sight (yeah, what?)

Nothin' nice (yeah), baguettes in my ice (aww, man)

Jesus Christ (yeah), checks over stripes (yeah)

That's what I like (yeah), that's what we like (yeah)

Lost my respect, you not a threat

When I shoot my shot, that shit wetty like I'm Sheck (bitch!)

See the shots that I took (ayy), wet like I'm Book (ayy)

Wet like I'm Lindsey, I be spending Folie's

Circle blocks 'til I'm dizzy (yeah, what?)

Like where is he? (Yeah, what?)

No one seen him (yeah, yeah)

I'm tryna clean 'em (yeah)



She's in love with who I am

Back in high school, I used to bust it to the dance

Now I hit the fbo with duffles in my hand (woo!)

I did half a Xan, thirteen hours 'til I land

Had me out like a light (like a light)

Like a light (like a light)

Like a light (yeah, like a light)

Like a light



Yeah, pass the dawgs in celly

Sendin' texts, ain't sendin' kites, yeah

He said \""keep that on lock\""

I said \""you know this shit, its life, yeah

It's absolute (yeah)

I'm back reboot (it's lit!)

LaFerrari to Jamba juice, yeah (skrrt, skrrt)

We back on the road

They jumpin' off

No parachute, yeah

Shorty in the back

She said she workin' on her glutes, yeah (oh my God)

Ain't by the book (yeah)

This how it look (yeah)

'Bout a check (yeah)

Just check the foots (yeah)

Passes to my daughter

I'ma show her what it took (yeah)

Baby mama cover Forbes

Got these other bitches shook, yeah",1,Sicko Mode,Money (power/flexing),Motivation (independance/confidence),2010,59,Sicko ModeTravis Scott
Maroon 5,2020,"Here's to the ones that we got

Cheers to the wish you were here, but you're not

'Cause the drinks bring back all the memories

Of everything we've been through

Toast to the ones here today

Toast to the ones that we lost on the way

'Cause the drinks bring back all the memories

And the memories bring back, memories bring back you



There's a time that I remember, when I did not know no pain

When I believed in forever, and everything would stay the same

Now my heart feel like December when somebody say your name

'Cause I can't reach out to call you, but I know I will one day, yeah



Everybody hurts sometimes

Everybody hurts someday, ayy-ayy

But everything gon' be alright

Go and raise a glass and say, ayy



Here's to the ones that we got

Cheers to the wish you were here, but you're not

'Cause the drinks bring back all the memories

Of everything we've been through

Toast to the ones here today

Toast to the ones that we lost on the way

'Cause the drinks bring back all the memories

And the memories bring back, memories bring back you



Doo-doo, doo-doo-doo-doo

Doo-doo-doo-doo, doo-doo-doo-doo

Doo-doo-doo-doo, doo-doo-doo

Memories bring back, memories bring back you



There's a time that I remember when I never felt so lost

When I felt all of the hatred was too powerful to stop (Ooh, yeah)

Now my heart feel like an ember and it's lighting up the dark

I'll carry these torches for ya that you know I'll never drop, yeah



Everybody hurts sometimes

Everybody hurts someday, ayy-ayy

But everything gon' be alright

Go and raise a glass and say, ayy



Here's to the ones that we got (Oh-oh)

Cheers to the wish you were here, but you're not

'Cause the drinks bring back all the memories

Of everything we've been through (No, no)

Toast to the ones here today (Ayy)

Toast to the ones that we lost on the way

'Cause the drinks bring back all the memories (Ayy)

And the memories bring back, memories bring back you



Doo-doo, doo-doo-doo-doo

Doo-doo-doo-doo, doo-doo-doo-doo

Doo-doo-doo-doo, doo-doo-doo

Memories bring back, memories bring back you

Doo-doo, doo-doo-doo-doo

Doo-doo-doo-doo, doo-doo-doo-doo

Doo-doo-doo-doo, doo-doo-doo (Ooh, yeah)

Memories bring back, memories bring back you



Yeah, yeah, yeah

Yeah, yeah, yeah, yeah, yeah, no, no

Memories bring back, memories bring back you",1,Memories,Friendship,Struggle (mental health/societal issue),2010,60,MemoriesMaroon 5
Lil Nas X,2021,"I caught it bad just today

You hit me with a call to your place

Ain't been out in a while anyway

Was I hopin' I could catch you throwin' smiles in my face

Romantic talkin'? You don't even have to try

You're cute enough to fuck with me tonight

Lookin' at the table, all I see is weed and white

Baby, you livin' the life, but nigga, you ain't livin' right



Cocaine and drinkin' with your friends

You live in the dark, boy, I cannot pretend

I'm not phased, only here to sin

If Eve ain't in your garden, you know that you can



Call me when you want, call me when you need

Call me in the morning, I'll be on the way

Call me when you want, call me when you need

Call me out by your name, I'll be on the way like



Hmm, hmm

Hmm, ah, hmm

Hmm, hmm, hmm

Ayy, ayy



I wanna sell what you're buyin'

I wanna feel on your ass in Hawaii

I want the jet lag from fuckin' and flyin'

Shoot a child in your mouth while I'm ridin'

Oh, oh, why me? A sign of the times, every time that I speak

A dime and a nine, it was mine every week

What a time, an incline god was shinin' on me

Now I can't leave

And now I'm actin' hella elite

Never walk with niggas that's in my league

I want to fuck the ones I envy, I envy



Cocaine and drinkin' with your friends

You live in the dark, boy, I cannot pretend

I'm not phased, only here to sin

If Eve ain't in your garden, you know that you can



Call me when you want, call me when you need

Call me in the morning, I'll be on the way

Call me when you want, call me when you need

Call me out by your name, I'll be on the way like



Oh, call me by your name (Hmm, hmm)

You told me you loved me in private (Hmm, ah, hmm)

Call me by your name, I do not care if you lyin' (Hmm, hmm, hmm)



Oh",1,Montero (Call Me by Your Name),Desire (love/flirting),Money (power/flexing),2010,61,Montero (Call Me by Your Name)Lil Nas X
Justin Bieber,2022,"Youngblood thinks there's always tomorrow

I miss your touch some nights when I'm hollow

I know your cross the bridge I can't follow

Since the love that you left is all that I get

I want you to know that



If I can't be close to you

I'll settle for the ghost of you

I miss you more than life

And if you can't be next to me

Your memory is ecstasy

I miss you more than life

I miss you more than life



Youngblood thinks there's always tomorrow

I need more time, but time can't be borrowed

I'd leave it all behind if I could follow



Since the love that you left is all that I get

I want you to know that



If I can't be close to you

I'll settle for the ghost of you

I miss you more than life

And if you can't be next to me

Your memory is ecstasy

I miss you more than life

I miss you more than life

I miss you more than life

If I can't be close to you

I'll settle for the ghost of you

I miss you more than life

And if you can't be next to me

Your memory is ecstasy

I miss you more than life

I miss you more than life",1,Ghost,Death (loss/grief),Struggle (mental health/societal issue),2010,62,GhostJustin Bieber
Luke Combs,2023,"You got a fast car

And I want a ticket to anywhere

Maybe we make a deal

Maybe together we can get somewhere

Any place is better

Starting from zero, got nothing to lose

Maybe we'll make something

Me, myself, I got nothing to prove



You got a fast car

And I got a plan to get us out of here

I've been working at the convenience store

Managed to save just a little bit of money

Won't have to drive too far

Just across the border and into the city

And you and I can both get jobs

Finally see what it means to be living



See, my old man's got a problem

He lives with the bottle, that's the way it is

He said his body's too old for working

His body's too young to look like his

So Mama went off and left him

She wanted more from life than he could give

I said, somebody's got to take care of him

So I quit school and that's what I did



You got a fast car

Is it fast enough so we can fly away?

Still gotta make a decision

Leave tonight or live and die this way



So I remember when we were driving, driving in your car

Speed so fast, I felt like I was drunk

City lights lay out before us

And your arm felt nice wrapped around my shoulder

And I-I, had a feeling that I belonged

I-I had a feeling I could be someone, be someone, be someone



You got a fast car

We go cruising to entertain ourselves

You still ain't got a job

So I work in the market as a checkout girl

I know things will get better

You'll find work and I'll get promoted

And we'll move out of the shelter

Buy a bigger house and live in the suburbs



So I remember when we were driving, driving in your car

Speed so fast, I felt like I was drunk

City lights lay out before us

And your arm felt nice wrapped around my shoulder

And I-I, had a feeling that I belonged

I-I had a feeling I could be someone, be someone, be someone



You got a fast car

I got a job that pays all our bills

You stay out drinking late at the bar

See more of your friends than you do of your kids

I'd always hoped for better

Thought maybe together you and me would find it

I got no plans, I ain't going nowhere

Take your fast car and keep on driving



So I remember when we were driving, driving in your car

Speed so fast, I felt like I was drunk

City lights lay out before us

And your arm felt nice wrapped around my shoulder

And I-I, had a feeling that I belonged

I-I had a feeling I could be someone, be someone, be someone



You got a fast car

Is it fast enough so we can fly away?

Still gotta make a decision

Leave tonight or live and die this way",0,Fast Car,Desire (love/flirting),Struggle (mental health/societal issue),2010,63,Fast CarLuke Combs
Sabrina Carpenter,2024,"Now he's thinkin' 'bout me every night, oh

Is it that sweet? I guess so

Say you can't sleep, baby, I know

That's that me espresso

Move it up, down, left, right, oh

Switch it up like Nintendo

Say you can't sleep, baby, I know

That's that me espresso



I can't relate

To desperation

My 'give a fucks' are on vacation

And I got this one boy

And he won't stop calling

When they act this way

I know I got em'



Too bad your ex don't do it for ya

Walked in and dream came trued it for ya

Soft skin and I perfumed it for ya

I know I Mountain Dew it for ya

That morning coffee brewed it for ya

One touch and I brand newed it for ya



Now he's thinkin' 'bout me every night, oh

Is it that sweet? I guess so

Say you can't sleep, baby, I know

That's that me espresso

Move it up, down, left, right, oh

Switch it up like Nintendo

Say you can't sleep, baby, I know

That's that me espresso



Holy shit

Is it that sweet? I guess so



I'm working late 'cause I'm a singer

Oh, he looks so cute wrapped around my finger

My twisted humor make him laugh so often

My honey bee, come and get this pollen



Too bad your ex don't do it for ya

Walked in and dream came trued it for ya

Soft skin and I perfumed it for ya

I know I Mountain Dew it for ya

That morning coffee brewed it for ya

One touch and I brand newed it for ya



Now he's thinkin' 'bout me every night, oh

Is it that sweet? I guess so

Say you can't sleep, baby, I know

That's that me espresso

Move it up, down, left, right, oh

Switch it up like Nintendo

Say you can't sleep, baby, I know

That's that me espresso



Thinkin' 'bout me every night, oh

Is it that sweet? I guess so

Say you can't sleep, baby, I know

That's that me espresso

Move it up, down, left, right, oh

Switch it up like Nintendo

Say you can't sleep, baby, I know

That's that me espresso



Is it that sweet? I guess so

Mmm, that's that me espresso",1,Espresso,Desire (love/flirting),Motivation (independance/confidence),2020,64,EspressoSabrina Carpenter
Elvis Presley,1960,"Schroeder - Wally Gold)

It's now or never,

come hold me tight

Kiss me my darling,

be mine tonight

Tomorrow will be too late,

it's now or never

My love won't wait.



When I first saw you

with your smile so tender

My heart was captured,

my soul surrendered

I'd spend a lifetime

waiting for the right time

Now that your near

the time is here at last.



It's now or never,

come hold me tight

Kiss me my darling,

be mine tonight

Tomorrow will be too late,

it's now or never

My love won't wait.



Just like a willow,

we would cry an ocean

If we lost true love

and sweet devotion

Your lips excite me,

let your arms invite me

For who knows when

we'll meet again this way



It's now or never,

come hold me tight

Kiss me my darling,

be mine tonight

Tomorrow will be too late,

it's now or never

My love won't wait.",0,It's Now or Never,Desire (love/flirting),Love (devotion),1990,0,It's Now or NeverElvis Presley
Chubby Checker,1961,"It's pony time,get up
Boogety, boogety, boogety shoo

Hey now let's party with the union hall,
It's pony time when ya hear this call,
So get with it,

Don't quit it,

Get up.



Do the pony with your partner,

With a big boss line,

Well anyway ya do it,

You're gonna look real fine,

So get with it,

Don't quit it,

Get up.



Now ya turn to the left when I say gee,

You turn to the right when I say haw,

Now gee, ya ya baby,

Now haw, ya oh baby, oh baby, pretty baby,

Do it baby, oh baby, oh baby,

Boogety, boogety, boogety, boogety shoo.



Gonna see little Suzie, who lives next door,

She's doin' the pony, she's takin' the floor,

Eeea ah, so get with it, don't quit it, come on,

Boogety, boogety,b oogety, boogety shoo.



Do the pony with your pardner,

Oh in a big boss line,

But anyway you do it,

You're gonna look just fine,

So get with, Don't quit it,

Come on. Eeeaaah



Now you turn to the left when I say gee,

You turn to the right when I say haw,

Now gee, ya ya little baby,

Now haw, ya oh baby, oh baby, pretty baby,

Do it baby, oh baby, oh baby,

Boogety, boogety, boogety, boogety shoo.",0,Pony Time,Dancing (clubbing/happy),Motivation (independance/confidence),1980,1,Pony TimeChubby Checker
Shelley Fabares,1962,"Johnny angel, how I love him

He's got something I can't resist

But he doesn't even know that I exist

Johnny angel, how I want him

How I tingle when he passes by

Every time he says hello, my heart begins to fly



I remember how I get carried away

I dream of him and me, and how it's gonna be



Other fellas call me up for a date

But I just sit and wait

I'd rather concentrate on



...Johnny Angel

'Cause I love him

And I pray that someday he'll love me

And together we will see how lovely heaven will be",0,Johnny Angel,Desire (love/flirting),Love (devotion),1990,2,Johnny AngelShelley Fabares
Kyu Sakamoto,1963,"Ue wo muite

arukou.

Namidaga koborenai youni

Omoidasu, haru no hi

Hitoribocchino yoru.

Ue wo muite

arukou.

Nijinda hoshi wo kazoete

Omoidasu, natsu no hi,

hitoribocchino yoru.



Shiawase wa kumo no ue ni,

Shiawase wa sora no ue ni.



Ue wo muite arukou.

Namidaga koborenai youni

naki nagara,

aruku, hitoribocchino yoru.



Omoidasu, aki no hi,

hitoribocchino yoru.



Kanashimi wa hoshi no kageni,

Kanashima wa tsuki no kageni.



Ue wo muite arukou.

Namidaka kobore naiyouni,

Naki nagara, aruku,

hitoribocchino yoru.



Hitoribocchino yoru",0,Sukiyaki,Love (devotion),Other,2000,3,SukiyakiKyu Sakamoto
Dean Martin,1964,"Everybody loves somebody sometime

Everybody falls in love somehow

Something in your kiss just told me

That sometime is now

Everybody finds somebody someplace

There's no telling whre love may appear

Something in my heart keeps saying

My someplace is here



If I had it in my power

I'd arrange for every girl to have your charms

Then every minute, every hour

Everybody would find what I found in your arms



Everybody loves somebody sometime

And though my dreams were overdue

Your love made it all worth waiting

For someone like you



If I had it in my power

I'd arrange for every girl to have your charms

Then every minute, every hour

Everybody would find what I found in your arms



Everybody loves somebody sometime

And though my dreams were overdue

Your love made it all worth waiting

For someone like you",1,Everybody Loves Somebody,Desire (love/flirting),Love (devotion),2000,4,Everybody Loves SomebodyDean Martin
Petula Clark,1965,"When you're alone and life is making you lonely

You can always go - downtown

When you've got worries, all the noise and the hurry

Seems to help, I know - downtown

Just listen to the music of the traffic in the city

Linger on the sidewalk where the neon signs are pretty

How can you lose?



The lights are much brighter there

You can forget all your troubles, forget all your cares

So go downtown, things'll be great when you're

Downtown - no finer place, for sure

Downtown - everything's waiting for you



Don't hang around and let your problems surround you

There are movie shows - downtown

Maybe you know some little places to go to

Where they never close - downtown

Just listen to the rhythm of a gentle bossa nova

You'll be dancing with him too before the night is over

Happy again



The lights are much brighter there

You can forget all your troubles, forget all your cares

So go downtown, where all the lights are bright

Downtown - waiting for you tonight

Downtown - you're gonna be all right now



And you may find somebody kind to help and understand you

Someone who is just like you and needs a gentle hand to

Guide them along



So maybe I'll see you there

We can forget all our troubles, forget all our cares

So go downtown, things'll be great when you're

Downtown - don't wait a minute more

Downtown - everything's waiting for you



Downtown, downtown, downtown, downtown ...",0,Downtown,Motivation (independance/confidence),Struggle (mental health/societal issue),1990,5,DowntownPetula Clark
