artist,year,lyrics,recognized,name,topic1,topic2,decade,id,song_hash
Ray Charles,1962,"(I can't stop loving you)

I've made up my mind

To live in memory of the lonesome times

(I can't stop wanting you)

It's useless to say

So I'll just live my life in dreams of yesterday

(Dreams of yesterday)

Those happy hours that we once knew

Tho' long ago, they still make me blue

They say that time heals a broken heart

But time has stood still since we've been apart



(I can't stop loving you)

I've made up my mind

To live in memories of the lonesome times

(I can't stop wanting you)

It's useless to say

So I'll just live my life in dreams of yesterday

(Those happy hours)

Those happy hours

(That we once knew)

That we once knew

(Tho' long ago)

Tho' long ago

(Still make me blue)

Still ma-a-a-ake me blue

(They say that time)

They say that time

(Heals a broken heart)

Heals a broken heart

(But time has stood still)

Time has stood still

(Since we've been apart)

Since we've been apart



(I can't stop loving you)

I said I made up my mind

To live in memory of the lonesome times

(Sing a song, children)

(I can't stop wanting you)

It's useless to say

So I'll just live my life of dreams of yesterday

(Of yesterday)",0,I Can't Stop Loving You,Love (devotion),Break-up (heartbreak),1950,2,I Can't Stop Loving YouRay Charles
Bobby Vinton,1963,"She wore blue velvet 
Bluer than velvet was the night 
Softer than satin was the light 
From the stars 
She wore blue velvet 
Bluer than velvet were her eyes 

Warmer than May her tender sighs 

Love was ours 

Ours a love I held tightly 

Feeling the rapture grow 

Like a flame burning brightly 

But when she left, gone was the glow of 

Blue velvet 

But in my heart there'll always be 

Precious and warm, a memory 

Through the years 

And I still can see blue velvet 

Through my tears",0,Blue Velvet,Love (devotion),Death (loss/grief),1980,3,Blue VelvetBobby Vinton
Louis Armstrong,1964,"Hello, Dolly,
Well, hello, Dolly
It's so nice to have you back where you belong
You're lookin' swell, Dolly
I can tell, Dolly
You're still glowin', you're still crowin'
You're still goin' strong
We feel the room swayin'
While the band's playin'
One of your old favourite songs from way back when
So, take her wrap, fellas
Find her an empty lap, fellas
Dolly'll never go away again
Hello, Dolly,
Well, hello, Dolly
It's so nice to have you back where you belong
You're lookin' swell, Dolly
I can tell, Dolly
You're still glowin', you're still crowin'
You're still goin' strong
We feel the room swayin'
While the band's playin'
One of your old favourite songs from way back when
Golly, gee, fellas
Find her a vacant knee, fellas
Dolly'll never go away
Dolly'll never go away
Dolly'll never go away again",0,"Hello, Dolly!",Desire (love/flirting),Dancing (clubbing/happy),1960,4,"Hello, Dolly!Louis Armstrong"
The Rolling Stones,1965,"I can't get no satisfaction, I can't get no satisfaction
'Cause I try and I try and I try and I try
I can't get no, I can't get no
When I'm drivin' in my car, and the man comes on the radio
He's tellin' me more and more about some useless information
Supposed to fire my imagination
I can't get no. Oh, no, no, no. Hey, hey, hey
That's what I say
I can't get no satisfaction, I can't get no satisfaction
'Cause I try and I try and I try and I try
I can't get no, I can't get no
When I'm watchin' my TV and a man comes on and tells me
How white my shirts can be
But, he can't be a man 'cause he doesn't smoke
The same cigarettes as me
I can't get no. Oh, no, no, no. Hey, hey, hey
That's what I say
I can't get no satisfaction, I can't get no girl reaction
'Cause I try and I try and I try and I try
I can't get no, I can't get no
When I'm ridin' round the world, and I'm doin' this and I'm signin' that
And I'm tryin' to make some girl, who tells me
Baby, better come back maybe next week
'Cause you see I'm on a losing streak
I can't get no. Oh, no, no, no. Hey, hey, hey
That's what I say. I can't get no, I can't get no
I can't get no satisfaction, no satisfaction
No satisfaction, no satisfaction",0,(I Can't Get No) Satisfaction,Desire (love/flirting),Motivation (independance/confidence),2000,5,(I Can't Get No) SatisfactionThe Rolling Stones
The Monkees,1966,"Take the last train to Clarksville, 
And I'll meet you at the station. 
You can be by four thirty, 
'Cause I made your reservation. 
Don't be slow...

Oh, no, no, no !

Oh, no, no, no !



'Cause I'm leaving in the morning 

And I must see you again 

We'll have one more night together 

'til the morning brings my train. 

And I must go...

Oh, no, no, no ! 

Oh, no, no, no ! 

And I don't know if I'm ever coming home. 



Take the last train to Clarksville. 

I'll be waiting at the station. 

We'll have time for coffee flavored kisses 

And a bit of conversation. 

Oh, no, no, no ! 

Oh, no, no, no ! 



Dou dou dou dou dou dou....



Take the last train to Clarksville, 

Now I must hang up the phone. 

I can't hear you in this noisy 

Railroad station all alone. 

I'm feeling low... 

Oh, no, no, no! 

Oh, no, no, no! 

And I don't know if I'm ever coming home. 







Take the last train to Clarksville, 

And I'll meet you at the station. 

You can be by four thirty, 

'Cause I made your reservation, 

Don't be slow...

Oh, no, no, no !

Oh, no, no, no !

And I don't know if I'm ever coming home. 



Take the last train to clarksville, 

Take the last train to clarksville !!!

Take the last train to clarksville !!!",0,Last Train to Clarksville,Love (devotion),Break-up (heartbreak),1950,6,Last Train to ClarksvilleThe Monkees
The Box Tops,1967,"Gimme a ticket for an aeroplane,

Ain't got time to take a fast train.

Lonely days are gone, I'm a-goin' home,

'Cause my baby just a-wrote me a letter.

I don't care how much money I gotta spend, 

Got to get back to my baby again 

Lonely days are gone, I'm a-goin' home,

'Cause my baby just a-wrote me a letter.



Well, she wrote me a letter 

Said she couldn't live without me no mo'.

Listen mister can't you see I got to get back 

To my baby once a-mo'--anyway...



Gimme a ticket for an aeroplane,

Ain't got time to take a fast train.

Lonely days are gone, I'm a-goin' home,

'Cause my baby just a-wrote me a letter.



Well, she wrote me a letter 

Said she couldn't live without me no mo'.

Listen mister can't you see I got to get back 

To my baby once a-mo'--anyway...



Gimme a ticket for an aeroplane,

Ain't got time to take a fast train.

Lonely days are gone, I'm a-goin' home,

'Cause my baby just a-wrote me a letter.

Because my baby just a-wrote me a letter.",0,The Letter,Desire (love/flirting),Love (devotion),1960,7,The LetterThe Box Tops
Paul Mauriat,1968,"Blue, blue, my world is blue
Blue is my world now I'm without you
Gray, gray, my life is gray
Cold is my heart since you went away

Red, red, my eyes are red

Crying for you alone in my bed

Green, green, my jealous heart

I doubted you and now we're apart



When we met how the bright sun shone

Then love died, now the rainbow is gone



Black, black, the nights I've known

Longing for you so lost and alone",0,Love is Blue,Break-up (heartbreak),"Jealousy (cheating, promiscuity)",1970,8,Love is BluePaul Mauriat
The Rolling Stones,1969,"I met a gin-soaked bar-room queen in Memphis
She tried to take me upstairs for a ride
She had to heave me right across her shoulder
'Cause I just can't seem to drink you off my mind

It's the honky tonk women

Gimme, gimme, gimme the honky tonk blues



I laid a divorcée in New York City

I had to put up some kind of a fight

The lady then she covered me in roses

She blew my nose and then she blew my mind



It's the honky tonk women

Gimme, gimme, gimme the honky tonk blues

All right



It's the honky tonk women

That gimme, gimme, gimme the honky tonk blues



It's the honky tonk women

Gimme, gimme, gimme the honky tonk blues",0,Honky Tonk Women,Desire (love/flirting),Dancing (clubbing/happy),1950,9,Honky Tonk WomenThe Rolling Stones
The Guess Who,1970,"{Prologue)

American woman gonna mess your mind

American woman, she gonna mess your mind

American woman gonna mess your mind

American woman gonna mess your mind

Say A,

Say M,

Say E,

Say R,

Say I,

Say C,

Say A,

Say N,

American woman gonna mess your mind

American woman gonna mess your mind

American woman gonna mess your mind



American woman, stay away from me

American woman, mama let me be

Don't come hangin' around my door

I don't wanna see your face no more

I got more important things to do

Than spend my time growin' old with you

Now woman, I said stay away,

American woman, listen what I say.



American woman, get away from me

American woman, mama let me be

Don't come knockin' around my door

Don't wanna see your shadow no more

Coloured lights can hypnotize

Sparkle someone else's eyes

Now woman, I said get away

American woman, listen what I say.



American woman, said get away

American woman, listen what I say

Don't come hangin' around my door

Don't wanna see your face no more

I don't need your war machines

I don't need your ghetto scenes

Coloured lights can hypnotize

Sparkle someone else's eyes

Now woman, get away from me

American woman, mama let me be.



Go, gotta get away, gotta get away

Now go go go

Gonna leave you, woman

Gonna leave you, woman

Bye-bye

Bye-bye

Bye-bye

Bye-bye

You're no good for me

I'm no good for you

Gonna look you right in the eye.

Tell you what I'm gonna do

You know I'm gonna leave

You know I'm gonna go

You know I'm gonna leave

You know I'm gonna go, woman

I'm gonna leave, woman

Goodbye, American woman

Goodbye, American chick

Goodbye, American broad ...",0,American Woman,Break-up (heartbreak),Other,1960,10,American WomanThe Guess Who
Bee Gees,1971,"I can think of younger days 
when living for my life 
was everything a man could want to do. 
I could never see tomorrow, 
but I was never told about the sorrow. 


And how can you mend a broken heart? 

How can you stop the rain from falling down? 

How can you stop the sun from shining? 

What makes the world go round? 



How can you mend this broken man? 

How can a loser ever win? 

Please help me mend my broken heart 

and let me live again. 



I can still feel the breeze 

that rustles through the trees 

and misty memories of days gone by. 

We could never see tomorrow, 

no one said a word about the sorrow. 



And how can you mend a broken heart? 

How can you stop the rain from falling down? 

How can you stop the sun from shining? 

What makes the world go round? 



How can you mend this broken man? 

How can a loser ever win? 

Please help me mend my broken heart 

and let me live again.",0,How Can You Mend a Broken Heart,Break-up (heartbreak),Struggle (mental health/societal issue),1990,11,How Can You Mend a Broken HeartBee Gees
Gilbert O'Sullivan,1972,"In a little while from now

If I'm not feeling any less sour

I promise myself to treat myself

And visit a nearby tower

And climbing to the top

Will throw myself off

In an effort to

Make it clear to whoever

Wants to know what it's like

When you're shattered

Left standing in the lurch at a church

Where people are saying, My God, that's tough

She stood him up

No point in us remaining

We may as well go home

As I did on my own

Alone again, naturally



To think that only yesterday

I was cheerful, bright and gay

Looking forward to who wouldn't do

The role I was about to play

But as if to knock me down

Reality came around

And without so much as a mere touch

Cut me into little pieces

Leaving me to doubt

Talk about, God in His mercy

Oh, if he really does exist

Why did he desert me

In my hour of need

I truly am indeed

Alone again, naturally



It seems to me that there are more hearts

Broken in the world that can't be mended

Left unattended

What do we do

What do we do



Alone again, naturally



Looking back over the years

And whatever else that appears

I remember I cried when my father died

Never wishing to hide the tears

And at sixty-five years old

My mother, God rest her soul

Couldn't understand why the only man

She had ever loved had been taken

Leaving her to start

With a heart so badly broken

Despite encouragement from me

No words were ever Spoken.

And when she passed away

I cried and cried all day

Alone again, naturally

Alone again, naturally",0,Alone Again (Naturally),Death (loss/grief),Struggle (mental health/societal issue),1950,12,Alone Again (Naturally)Gilbert O'Sullivan
Roberta Flack,1973,"Strumming my pain with his fingers

Singing my life with his words

Killing me softly with his song

Killing me softly with his song

Telling my whole life with his words

Killing me softly with his song



I heard he sang a good song

I heard he had a style

And so I came to see him

To listen for a while

And there he was this young boy

A stranger to my eyes



Strumming my pain with his fingers

Singing my life with his words

Killing me softly with his song

Killing me softly with his song

Telling my whole life with his words

Killing me softly with his song



I felt all flushed with fever

Embarassed by the crowd

I felt he found my letters

And read each one out loud

I prayed that he would finish

But he just kept right on



Strumming my pain with his fingers

Singing my life with his words

Killing me softly with his song

Killing me softly with his song

Telling my whole life with his words

Killing me softly with his song



He sang as if he knew me

In all my dark despair

And then he looked right through me

As if I wasn't there

And he just kept on singing

Singing clear and strong



Strumming my pain with his fingers

Singing my life with his words

Killing me softly with his song

Killing me softly with his song

Telling my whole life with his words

Killing me softly with his song





Strumming my pain with his fingers

Singing my life with his words

Killing me softly with his song

Killing me softly with his song

Telling my whole life with his words

Killing me



He was strumming my pain

Yeah, he was singing my life

Killing me softly with his song

Killing me softly with his song

Telling my whole life with his words

Killing me softly

With his song",1,Killing Me Softly with His Song,Love (devotion),Break-up (heartbreak),1970,13,Killing Me Softly with His SongRoberta Flack
Terry Jacks,1974,"Goodbye to you my trusted friend

We've known each other since we were nine or ten

Together we've climbed hills and trees

Learned of love and A B C's

Skinned our hearts and skinned our knees.

Goodbye my friend it's hard to die

When all the birds are singing in the sky

Now that the spring is in the air

Pretty girls are everywhere

Think of me and I'll be there



We had joy we had fun

We had seasons in the sun

But the hills that we climbed were just seasons

Out of time......



Goodbye Papa please pray for me

I was the black sheep of the family

You tried to teach me right from wrong

Too much wine and too much song

Wonder how I got along.



Goodbye Papa its hard to die

When all the birds are singing in the sky

Now that the spring is in the air

Little children everywhere

When you see them I'll be there.



We had joy we had fun

We had seasons in the sun

But the wine and the song like the seasons

Have all gone.



We had joy we had fun

We had seasons in the sun

But the wine and the song like the seasons

Have all gone.



Goodbye Michelle my little one

You gave me love and helped me find the sun

And every time that I was down

You would always come around

And get my feet back on the ground.



Goodbye Michelle it's hard to die

When all the birds are singing in the sky

Now that the spring is in the air

With the flowers everywhere

I wish that we could both be there



We had joy we had fun

We had seasons in the sun

But the stars we could reach

Were just starfish on the beach



We had joy we had fun

We had seasons in the sun

But the stars we could reach

Were just starfish on the beach



We had joy we had fun

We had seasons in the sun

But the wine and the song like the seasons

Have all gone



All our lives we had fun

We had seasons in the sun

But the wine and the song like the sesons have all gone



All our lives we had had fun

We had sesons in the sun

but the hill that we climbed were just seasons out of time



(repeat last to fade)",0,Seasons in the Sun,Friendship,Death (loss/grief),1960,14,Seasons in the SunTerry Jacks
Elton John,1975,"I used to be a rolling stone

You know if the cause was right

I'd leave to find the answer on the road

I used to be a heart beating for someone

But the times have changed

The less I say the more my work gets done



`Cause I live and breathe this Philadelphia freedom

From the day that I was born I've waved the flag

Philadelphia freedom took me knee-high to a man

Yeah gave me peace of mind my daddy never had



Oh Philadelphia freedom shine on me, I love you

Shine a light through the eyes of the ones left behind

Shine a light shine a light

Shine a light won't you shine a light

Philadelphia freedom I love you, yes I do



If you choose to you can live your life alone

Some people choose the city

Some others choose the good old family home

I like living easy without family ties

Till the whippoorwill of freedom zapped me

Right between the eyes",0,Philadelphia Freedom,Motivation (independance/confidence),Struggle (mental health/societal issue),1990,15,Philadelphia FreedomElton John
Elton John,1976,"Don't go breaking my heart

I couldn't if I tried

Honey if I get restless

Baby you're not that kind

Don't go breaking my heart

You take the weight off me

Honey when you knock on my door

I gave you my key



Nobody knows it

When I was down

I was your clown

Nobody knows it

Right from the start

I gave you my heart

I gave you my heart



So don't go breaking my heart

I won't go breaking your heart

Don't go breaking my heart



And nobody told us

`Cause nobody showed us

And now it's up to us babe

I think we can make it



So don't misunderstand me

You put the light in my life

You put the sparks to the flame

I've got your heart in my sights",1,Don't Go Breaking My Heart,Desire (love/flirting),Love (devotion),1970,16,Don't Go Breaking My HeartElton John
Andy Gibb,1977,"For so long 
You and me been finding each other for so long

And the feeling that I feel for you is more then strong, girl

Take it from me

If you give a little more then you're asking for 
Your love will turn the key 



Darling, mine 

I would wait forever for those lips of wine

Build my world around you, Darling

This love will shine, girl

Watch it and see

If you give a little more then you're asking for

Your love will turn the key



I, I just want to be your everything

Open up the Heaven in your heart and let me be

The things you are to me and not some puppet on a string

Oh, if I stay here without you, Darling, I will die

I want you laying in the love I have to bring

I'd do anything to be your everything



Darling, for so long 

You and me been finding each other for so long

And the feeling that I feel for you is more then strong, girl

Take it from me

If you give a little more then you're asking for 

Your love will turn the key



I, I just want to be your everything

Open up the heaven in your heart and let me be

The things you are to me and not some puppet on a string

Oh, if I stay here without you, Darling, I will die

I want you laying in the love I have to bring

I'd do anything to be your everything



I, I just want to be your everything

Open up the heaven in your heart and let me be

The things you are to me and not some puppet on a string

Oh, if I stay here without you, Darling, I will die

I want you laying in the love I have to bring

'Cause I'd do anything to be your everything",0,I Just Want to Be Your Everything,Desire (love/flirting),Love (devotion),1980,17,I Just Want to Be Your EverythingAndy Gibb
Bee Gees,1978,"Listen to the ground,

there is movement all around.,

there is something going down

and I can feel it.

On the waves of the air,

there is dancing out there.

If it's something we can share,

we can steal it.



And the sweet city woman,

she moves through the light,

controlling my mind and my soul.



When you reach out for me, yeah,

and the feeling is bright.



Then I get night fever, night fever.

We know how to do it (oh).

Gimme that night fever, night fever.

We know how to show it.



Here I am,

praying for this moment to last,

living on the music so fine,

borne on the wind,

making it mine.



Night fever, night fever.

We know how to do it (oh).

Gimme that night fever, night fever.

We know how to show it.



In the heat of our love,

don't need no help for us to make it.

Gimme just enough to take us to the morning.



I got fire in my mind.

I get higher in my walking.

And I'm glowing in the dark,

I give you warning.



And the sweet city woman,

she moves through the light,

controlling my mind and my soul.



When you reach out for me, yeah,

and the feeling is bright.



Then I get night fever, night fever.

We know how to do it.

Gimme that night fever, night fever.

We know how to show it.



Here I am,

praying for this moment to last,

living on the music so fine,

borne on the wind,

making it mine.



Night fever, night fever.

We know how to do it.

Gimme that night fever, night fever.

We know how to show it.



Gimme that night fever, night fever.

We know how to do it.

Gimme that night fever, night fever.

We know how to show it.

Gimme that night fever, night fever.

We know how to do it....",0,Night Fever,Desire (love/flirting),Dancing (clubbing/happy),1970,18,Night FeverBee Gees
Donna Summer,1979,"Bad girls

Talking about the sad girls

Sad girls

Talking about bad girls, yeah

See them out on the street at night

Picking up on all kinds of strangers

If the price is right

You can't score if you're pocket's tight

But you want a good time

You ask yourself who they are

Like everybody else

They come from near and far

Bad girls, yeah



Bad girls

Talking about the sad girls, yeah

Sad girls

Talking about bad girls, yeah



Friday night and the strip is hot

Sun's gone down and they're out to trot

Spirit's high and legs look hot

Do you wanna get down

Now don't you ask yourself who they are

Like everybody else, they wanna be a star - yeah yeah 



Bad girl

Sad girl, you're such a dirty bad girl

Beep-Beep, uh-uh

You bad girl you sad girl

Your such a dirty bad girl

Beep-Beep, uh-uh



Now you and me we're both the same

But you call yourself by different names

Now your mama won't like it when she finds out

girl is out at night



Hey, Mister, have you got a dime

Mister, do you want to spent some time

Oh, yeah

i got what you want

you got what I need

I'll be your baby come and spend it on me

hey Mister. ...I'll spend some time with you",0,Bad Girls,Desire (love/flirting),Other,1950,19,Bad GirlsDonna Summer
Olivia Newton-John,1980,"Come take my hand

You should know me

I've always been in your mind

You know that I'll be kind

I'll be guiding you

Building your dream

Has to start now

There's no other road to take

You won't make a mistake

I'll be guiding you



You have to believe we are magic

Nothin' can stand in our way

You have to believe we are magic

Don't let your aim ever stray

And if all your hopes survive

Your destiny will arrive

I'll bring all your dreams alive

For you



From where I stand

You are home free

The planets align so rare

There's promise in the air

And I'm guiding you



Through every turn I'll be near you

I'll come anytime you call

I'll catch you when you fall

I'll be guiding you



You have to believe we are magic

Nothin' can stand in our way

You have to believe we are magic

Don't let your aim ever stray

And if all your hopes survive

Your destiny will arrive

I'll bring all your dreams alive

For you",0,Magic,Love (devotion),Friendship,1980,20,MagicOlivia Newton-John
Diana Ross,1981,"My love

There's only you in my life

The only thing that's right

My first love

You're every breath that I take

You're every step I make



And I

I want to share

All my love with you

No one else will do



And your eyes

They tell me how much you care

Oh, yes you will always be

My endless love



Two hearts

Two hearts that beat as one

Our lives had just begun



Forever

I'll hold you close in my arms

I can't resist your charms



And love

I'll be a fool for you

I'm sure

You know I don't mind

Whoooooa, you know I don't mind



'Cos you

You mean the world to me

Oh, I know

I know I found in you

My endless love



[Instrumental Interlude]



Oooooooh

And love

I'll be that fool for you

I'm sure

You know I don't mind

Whooooa, you know I don't mind

And yes

You'll be the only one

'Cos no one can't deny

This love I have inside

And I'll give it all to you

My love

My endless love",0,Endless Love,Desire (love/flirting),Love (devotion),1980,21,Endless LoveDiana Ross
